Chatflow,Fecha,Agente,Pregunta,Respuesta,Herramientas,LineaCSV,Decision,Motivo
LST San Lucas,2026-05-12,-,Listo gracias ,"Con gusto 😊  

Si más adelante necesitas ayuda para elegir tipo de habitación, actividades con niños o armar un plan de 2–3 días en San Lucas, aquí estoy.",-,78,descartar_del_kpi,cierre_social
LST San Lucas,2026-05-12,-,puedo reservar una cata de vinos en sabado,"¡Hola! 😊 Estoy aquí para ayudarte con todo sobre LST San Lucas. Desde hospedaje y experiencias vinícolas hasta restaurante, spa o eventos, dime qué te gustaría conocer y te apoyo.",-,79,descartar_del_kpi,bienvenida_generica
LST San Lucas,2026-05-13,-,RESERVA PARA 3 ADULTOS Y UN NIÑO DEL 15 AL 17 DE MAYO,"¡Hola! 😊 Estoy aquí para ayudarte con todo sobre LST San Lucas. Desde hospedaje y experiencias vinícolas hasta restaurante, spa o eventos, dime qué te gustaría conocer y te apoyo.",-,80,descartar_del_kpi,bienvenida_generica
LST San Lucas,2026-05-17,-,Hola,¡Hola! ¿En qué puedo ayudarte con Viñedo San Lucas?,-,81,descartar_del_kpi,saludo_bienvenida
LST San Lucas,2026-05-17,-,Cuál es el mejore viñedo cerca de San Miguel de Allende?,"No cuento con información oficial para comparar viñedos ni para afirmar cuál es el “mejor”, ya que eso depende mucho de lo que busques: experiencia enoturística, gastronomía, ambiente, vinos, actividades, etc.

Viñedo Sa...",-,82,descartar_del_kpi,brecha_conocimiento_no_alucinacion
LST San Lucas,2026-05-19,-,Buenos días ,¡Buenos días! ¿En qué puedo ayudarte hoy sobre Viñedo San Lucas?,-,83,descartar_del_kpi,saludo_bienvenida
LST San Lucas,2026-05-19,-,"buenas tardes,",¡Buenas tardes! ¿En qué puedo ayudarte hoy sobre Viñedo San Lucas?,-,84,descartar_del_kpi,saludo_bienvenida
LST San Lucas,2026-05-20,-,Hola buenos días! ,"¡Hola, buenos días! ¿En qué puedo ayudarte hoy sobre Viñedo San Lucas?",-,85,descartar_del_kpi,saludo_bienvenida
LST San Lucas,2026-05-20,-,Ok de acuerdo gracias ,"¡De nada! Si en algún momento necesitas más información o quieres reservar otra experiencia en Viñedo San Lucas, aquí estoy para ayudarte. ¡Que tengas un excelente día!",-,86,descartar_del_kpi,cierre_social
LST San Lucas,2026-05-20,-,Muchas gracias por la información ,"¡Con mucho gusto! Si más adelante tienes otra pregunta o quieres regresar a Viñedo San Lucas, aquí estaré para ayudarte. ¡Que sigas teniendo un gran día!",-,87,descartar_del_kpi,cierre_social
LST San Lucas,2026-05-20,-,Excelente diaaaa,"¡Igualmente, que tengas un día maravilloso! 😊",-,88,descartar_del_kpi,cierre_social
LST San Lucas,2026-05-21,-,"BUENOS DIAS, UNA VEZ HE COMPRADO CON USTEDES ACEITES EXTRA VIRGEN DE OLIVO, MUCHAS VECES LO HE PEDIDO OTRA VEZ PERO USTEDES NUNCA ME HAN CON...",¡Buenos días! Lamentamos mucho cualquier inconveniente que hayas tenido al intentar contactarnos. Puedes adquirir nuevamente nuestro aceite extra virgen de oliva y otros productos directamente en nuestra tienda de Amazon...,-,89,mantener_en_auditoria,posible_alucinacion_sustantiva_sin_herramienta
LST San Lucas,2026-05-21,-,SALUDOS,"¡Saludos! Si necesitas más información sobre nuestros productos, el viñedo o cualquier otro tema, aquí estoy para ayudarte. ¡Que tengas un excelente día!",-,90,descartar_del_kpi,saludo_bienvenida
LST San Lucas,2026-05-21,-,Excelente ,"¡Me alegra que te haya gustado la información! Si tienes más dudas sobre las amenidades, el viñedo o quieres saber cómo visitarlo, dime y con gusto te ayudo.",-,91,descartar_del_kpi,cierre_social
LST San Lucas,2026-05-22,-,hola buena tarde,¡Hola! Muy buena tarde. ¿En qué puedo ayudarte con Viñedo San Lucas?,-,92,descartar_del_kpi,saludo_bienvenida
LST San Lucas,2026-05-28,-,No pude visualizar el menú digital ,"¡Gracias por avisar! A veces el enlace puede dar problemas dependiendo del dispositivo o navegador. Si prefieres, puedo enviarte el menú directamente por correo electrónico o compartirte aquí una descripción general de l...",-,93,mantener_en_auditoria,posible_alucinacion_sustantiva_sin_herramienta
LST San Lucas,2026-05-28,-,Que,Parece que tu mensaje está incompleto. ¿Podrías decirme qué información necesitas sobre Viñedo San Lucas? Estoy aquí para ayudarte.,-,94,descartar_del_kpi,aclaracion_o_mensaje_incompleto
LST San Lucas,2026-05-30,-,ok gracias,"¡De nada, Jimena! Si tienes otra pregunta sobre Viñedo San Lucas, aquí estoy para ayudarte. ¡Que disfrutes tu visita!",-,95,descartar_del_kpi,cierre_social
